	url	authors	publish_date	text	keywords	summary
41	https://comicbook.com/tv-shows/2018/07/22/fuller-house-star-lori-loughlin-shares-behind-scenes-season-4/	[]	2018-07-22 00:00:00	"Lori Loughlin just unveiled a sneak peek at what is to come in Fuller House season 4.

Loughlin, who plays Rebecca Donaldson-Katsopolis, took to her Instagram on Friday to reveal some shots from the set of the Netflix sitcom.

The main post saw Loughlin posing with the rest of the Fuller House cast, including Candace Cameron Bure, Jodie Sweetin, Andrea Barber and Bob Saget.

(Photo: Instagram / @loriloughlin)

That same post also showed the curtain call for the episode as the cast greeted an enthusiastic live studio audience.

Also shown in the clips was Dave Coulier, best known as family friend Joey Gladstone on Full House and the current spinoff. However, Coulier was not appearing on set as his character. He instead is returning as the direcotr of the episode Loughlin and Saget are returning for.

""It’s always nice to go home,"" Loughlin wrote. ""Thanks [Dave Coulier] you’re a wonderful director!""

In now removed Instagram story posts, Loughlin also showed more shots of Coulier directing, as well as a look at what the episode's plot will focus on. Saget appeared in character as Danny Tanner, but he was decked out in a hospital gown. This signals that the Tanner family patriarch is be dealing with some sort of health issue that brings his daughters to his side.

Earlier in the week, Loughlin also shared another look at Fuller House season 4.

(Photo: Instagram / @loriloughlin)

Loughlin is once again shown with several of her Fuller House castmates as they all pose for a selfie.

""Always a good time with this crew!"" Loughlin wrote.

While she stays busy with her Hallmark Channel projects such as Garage Sale Mystery and When Calls the Heart, Loughlin always loves reuniting with her Full House family.

She recently opened up to Hello Magazine about how the cast never expected they would still be close all these years later.

""We knew we had a great connection, but I don’t know that any of us could have ever known we’d have the friendship that we formed today,"" Loughlin said. ""We had no way of knowing that, or even the fact that the show would come back again after 25 years. No one would have [predicted] the show would have such staying power.""

She added, ""We have group texts. We email, talk or meet for lunch individually. John [Stamos, who played Uncle Jesse] will have a BBQ, I’ll have people over. Jeff Franklin, the creator of the show, is really good about always putting things together.""

All episodes of Fuller House are currently streaming on Netflix, and all episodes of Full House are streaming on Netflix.

Photo Credit: Netflix / Michael Yarish"	['fuller', 'behindthescenes', 'loughlin', 'star', 'cast', 'streaming', 'lori', 'instagram', 'season', 'coulier', 'netflix', 'episodes', 'tanner', 'look', 'house', 'shares']	"Lori Loughlin just unveiled a sneak peek at what is to come in Fuller House season 4.
The main post saw Loughlin posing with the rest of the Fuller House cast, including Candace Cameron Bure, Jodie Sweetin, Andrea Barber and Bob Saget.
Earlier in the week, Loughlin also shared another look at Fuller House season 4.
(Photo: Instagram / @loriloughlin)Loughlin is once again shown with several of her Fuller House castmates as they all pose for a selfie.
All episodes of Fuller House are currently streaming on Netflix, and all episodes of Full House are streaming on Netflix."
42	https://www.newsday.com/entertainment/celebrities/hangin-in-the-hamptons-lori-loughlin-beth-stern-1.20309785	['Elisa Distefano']	2018-08-05 23:11:15-05:00	"Lori Loughlin celebrated her Bella Magazine cover at a white party at the Southampton Social Club on Saturday. It was a happy homecoming for the Hauppauge native, who had her mother, brother and extended family with her. She posed for photos with fans and proudly held up a Hauppauge Athletics T-shirt.

""I love driving around the old neighborhood reminiscing. ... You know I've lived in California for 30 years but New York will always be my home I don’t think that will ever change,"" said Loughlin, 54.

These days Loughlin is busy shooting the sixth season of her Hallmark Channel show ""When Calls the Heart."" She also stars in the Garage Sale Mysteries movies on the Hallmark Movies & Mysteries channel all month.

On top of all that, she's also a part of Netflix's ""Fuller House"" cast, which was nominated for an Emmy. Loughlin says the fan response to the revival has been overwhelming: ""It’s great to be back with the 'Full House' family. We’ve always stayed in touch over the years but it’s fun to be working together again ... and we are on the same sound stage that we were on together 30 years ago when we first started the show.""

LIVING A HEALTH LIFE. Beth Stern celebrated all things healthy at the Healthy Guru Wellness & Fitness event presented by KIMA Social Life Magazine at the Southampton Arts Center on Saturday afternoon.

Stern says she stays healthy by practicing transcendental meditation with her husband, radio and TV personality Howard Stern, as well engaging in physical activity, whether its walking on the beach or doing jumping jacks, every single day.

Beth and Howard Stern share their Hamptons home with over 20 roommates -- foster cats and kittens. She calls it the ""craziest kitten season ever.""

Sign up for Newsday's Entertainment newsletter Get the latest on celebs, TV and more. By clicking Sign up, you agree to our privacy policy.

Beth Stern appears on the cover of Social Life Magazine next week. The photos were taken by her husband at the Evelyn Alexander Wildlife Rescue Center in Hampton Bays. She said they ""work very well together.""

As the couple approach their 10th wedding anniversary -- and 20 years of being together -- Beth Stern said, ""We spend a lot of time alone together, I don't think we get involved really in any of the craziness that our lives could be. We really just like to be together and go out with just a couple here and there. We like each other, we like being alone together, we really do and we share a passion for the animals that we are rescuing. We are just in tune, we're good."""	['stern', 'beth', 'hangin', 'loughlin', 'think', 'social', 'southampton', 'hamptons', 'lori', 'healthy', 'really', 'magazine', 'tv', 'life']	"Lori Loughlin celebrated her Bella Magazine cover at a white party at the Southampton Social Club on Saturday.
These days Loughlin is busy shooting the sixth season of her Hallmark Channel show ""When Calls the Heart.""
Beth Stern celebrated all things healthy at the Healthy Guru Wellness & Fitness event presented by KIMA Social Life Magazine at the Southampton Arts Center on Saturday afternoon.
Beth and Howard Stern share their Hamptons home with over 20 roommates -- foster cats and kittens.
Beth Stern appears on the cover of Social Life Magazine next week."
43	https://www.bustle.com/p/john-stamos-birthday-message-for-lori-loughlin-proves-that-uncle-jesse-aunt-becky-are-forever-9922558	['Mary Kate Mcgrath']	None	"Get ready to feel nostalgic, Full House fans. On Saturday, John Stamos posted an adorable birthday message for Lori Loughlin, and it featured a special throwback picture. These two actors have been co-stars for a long time, and they first appeared onscreen together as Jesse and Rebecca in Full House, which premiered in 1987. Stamos' post brought back memories of their early days on the series, and his message was a tribute to both their television roles and friendship.

The caption reads:

""Been Jesse to your Rebecca for 30 years. 30 more, then that’s it! I don’t for one second take for granted your talent, your heart and most importantly, our friendship. Happy Birthday Lori, XO"".

The post shows that these two have remained close pals over the years, and that neither star expects that to change. Loughlin and Stamos began their careers on the sitcom, which was popular throughout the late '80s and '90s. The series followed the story of TV sports anchor Danny Tanner, who recruits his comedian best friend Joey, and musician brother-in-law Jesse to help raise his daughters after his wife passes away. Danny becomes friends with another anchor named Rebecca Donaldson, who is played by Loughlin. Rebecca eventually falls for Jesse, and becomes part of the family.

Jesse and Rebecca ended up together on the show, and while Loughlin and Stamos never had a real-life romance, this birthday post shows that they remain close friends. According to The Today Show, Loughlin responded to the birthday wish, commenting, ""It's been a great 30! I'm so glad we've been on this journey together!! I love ya buddy!!""

In 2016, a sequel to the series called Fuller House premiered on Netflix, bringing the two stars back together onscreen. It turns out the whole cast of the reboot was by Loughlin's side on her birthday. On Saturday, she posted a group photo with Stamos, and her other co-stars Andrea Barber, Candace Bure, and Jodie Sweetin on Instagram. The caption read: ""So much love for this group!!!"" and was followed by several heart emojis. Bure, who plays D.J. Tanner, commented: ""Happy Birthday!!!! Love you tons and tons."" It looks like even though the actor spent most of her birthday on the set, the cast and crew made time to celebrate and have fun.

Stamos wasn't the only co-star to share a birthday wish for Loughlin. Barber posted a picture with the star from the Fuller House set, writing: ""Happy birthday to my beautiful friend Lori Loughlin, who has the best laugh, the prettiest smile, the funniest dog, and the biggest heart. I love you, Lori!"". Bob Saget also posted a picture with his co-star to Instagram, writing:

""Happy Birthday Lori. Always so sweet, so smart, so beautiful. So lucky to have you as a friend all these years. Let's make a real series out of ""Wake Up San Francisco."" Should play well in Kentucky. Love you.""

Ultimately, it's the bond between Stamos and Loughlin that fans can't seem to get enough of though. They've appeared alongside each other for over three decades, and built a pretty incredible friendship over the years. His sweet throwback post shows that they're still such good friends, and they're definitely keeping the Uncle Jesse and Aunt Becky feels alive."	['jesse', 'message', 'rebecca', 'love', 'john', 'loughlin', 'forever', 'uncle', 'post', 'lori', 'birthday', 'series', 'proves', 'stamos', 'posted']	"On Saturday, John Stamos posted an adorable birthday message for Lori Loughlin, and it featured a special throwback picture.
Stamos' post brought back memories of their early days on the series, and his message was a tribute to both their television roles and friendship.
Happy Birthday Lori, XO"".
Jesse and Rebecca ended up together on the show, and while Loughlin and Stamos never had a real-life romance, this birthday post shows that they remain close friends.
Bob Saget also posted a picture with his co-star to Instagram, writing:""Happy Birthday Lori."
44	https://www.moviefone.com/2018/06/21/lori-loughlin-fuller-house-set-photos-john-stamos/	[]	2018-06-21 00:00:00	"We're in between seasons of ""Fuller House,"" but that doesn't mean we're entirely without the Tanner-Fuller crew. Thanks to Lori Loughlin, we recently got a little dose of their family magic.

Loughlin posted a four photos on Thursday of her alongside co-star John Stamos. The two, who have continued to reprise their respective roles as Aunt Becky and Uncle Jesse in each season of the Netflix spinoff series, appear on the steps of the Tanner-Fuller house at Warner Bros. Studios. ""Hanging on the stoop,"" Loughlin wrote in her Instagram post.

""Fuller House"" Season 4 appears to be filming, as other cast members have also shared photos and videos from the set on social media. We don't know yet how many episodes Loughlin and Stamos will be in, but it's clear people are excited to see them together and back at it. In the comments, fans called them their ""fave TV couple,"" expressed concern over the fact that Stamos appears to have a bandage on his hand, and, of course, took advantage of the opportunity to quote Uncle Jesse's frequent refrain of ""Have mercy!""

""Fuller House"" was renewed for Season 4 in late January, and it is expected to return later this year."	['shared', 'jesse', 'fuller', 'wrote', 'warner', 'stamos', 'loughlin', 'forever', 'uncle', 'lori', 'season', 'set', 'appears', 'tannerfuller', 'house', 'photos']	"We're in between seasons of ""Fuller House,"" but that doesn't mean we're entirely without the Tanner-Fuller crew.
The two, who have continued to reprise their respective roles as Aunt Becky and Uncle Jesse in each season of the Netflix spinoff series, appear on the steps of the Tanner-Fuller house at Warner Bros. Studios.
""Hanging on the stoop,"" Loughlin wrote in her Instagram post.
""Fuller House"" Season 4 appears to be filming, as other cast members have also shared photos and videos from the set on social media.
""Fuller House"" was renewed for Season 4 in late January, and it is expected to return later this year."
45	https://www.elitedaily.com/p/this-fuller-house-season-4-pic-of-uncle-jesse-becky-is-too-much-to-handle-9542677	['Alana Altmann']	None	"Fuller House Season 4 is indeed happening, Tannerito fans, and it appears that filming is underway. TV aunt extraordinaire Lori Loughlin took to social media to share a snap of her and a special someone — her longtime small screen spouse, John Stamos — as they sat on the steps of the iconic San Fran (OK, Warner Bros. lot, but you get the picture) Tanner townhome. Her Fuller House Season 4 pic of Uncle Jesse and Becky in all their stoop-tastic glory is too cute for words. With every passing year, this iconic TV couple gets more adorable. Great — now I have the song ""Forever"" in my head...

The Full House spinoff Fuller House premiered February 2016 in what feels like the early days of the '90s reboot craze. The series has been a streaming success for Netflix and it was confirmed in January 2018 that there would be fourth season to look forward to. The second half of the third installment debuted in December — the two-part season kicked off last September. A premiere date for Season 4 has not been revealed (fingers crossed for an announcement shortly), but from the looks of Lori's Insta, shooting for the upcoming episodes has begun. Have mercy!

Lori's not the only cast member posting on-set Fuller House moments. Jodie Sweetin, aka Stephanie Tanner, posted a sweet pic on June 12 with the hashtag #FullerHouseFamily.

On June 2, Andrea Barber, who plays Kimmy Gibbler, gave her followers a look at what she dubbed ""curtain call shenanigans"" using the hashtag #season4.

The actress also posted a photo of a script/baby bump combo (her character is acting a surrogate for Stephanie) on May 18, noting that she was gearing up for the ""first live taping of Season 4.""

Candace Cameron Bure, who began portraying DJ Tanner over 30 years ago, revealed her hopes for the future of Fuller House in an interview with E! News earlier this year:

What's most important to me is as much fun as we have on that show, it's always about the heart and lessons that are learned as families. I really want to make sure we bring that in in season four, even more than we have in any other season.

Candace and Scott Weinger (yup, Steve) clutched their coffees in a sweet snap from May 22. Uncle Jesse and Becky aren't the only Fuller House duo serving behind-the-scenes pics...

Whether you're a newfound viewer of the ongoing Tanner family chronicles you watched Full House as a kid, or you catch Fuller House now that your own child is a fan — yeah, the show's been around since 1987 — the series' reach is undeniable. I watched Jesse and Becky fall in love, clash over their wedding plans, get married after Jess landed in jail (it was a minor tomato-based crime), have twins, move into the attic — and they're still on my radar in 2018. That's something I did not expect as an elementary school student while witnessing Jesse's heartfelt proposal.

""John and I always had fun playing the characters,"" Loughlin told Today in March when discussing her fan-fave television relationship. ""We had a fun rapport. I guess it’s a relationship that people look up to and want to emulate. I just know that they are two really loved characters. People love them as a couple; they love them together, which is very nice.”

Plus, John and Lori are pals in real life. Theactors have recurring roles on Fuller House and if Lori's pics are any indication, it looks like the '90s sweethearts will be back to reprise their beloved characters for Season 4."	['jesse', 'fun', 'pic', 'fuller', 'love', 'characters', 'becky', 'handle', 'uncle', 'season', 'tanner', 'look', 'house']	"Fuller House Season 4 is indeed happening, Tannerito fans, and it appears that filming is underway.
Her Fuller House Season 4 pic of Uncle Jesse and Becky in all their stoop-tastic glory is too cute for words.
The Full House spinoff Fuller House premiered February 2016 in what feels like the early days of the '90s reboot craze.
Lori's not the only cast member posting on-set Fuller House moments.
Uncle Jesse and Becky aren't the only Fuller House duo serving behind-the-scenes pics..."
