	url	authors	publish_date	text	keywords	summary
25	https://www.foxnews.com/entertainment/lori-loughlin-appeared-so-defiant-in-court-while-felicity-huffman-looked-more-genuine-says-sketch-artist	['Stephanie Nolasco']	None	"Artist Mona Shafer Edwards gave the world a sneak peek of what was really happening behind closed doors in the courtroom.

Edwards’ colorful sketches of actresses Lori Loughlin and Felicity Huffman facing the judge for their alleged involvement in a massive college admissions scandal quickly spread throughout social media. Cameras were not allowed inside the courtroom.

LORI LOUGHLIN'S DAUGHTERS STILL ENROLLED IN USC

Yahoo! Entertainment reported Friday the freelancer was determined to portray the players in the high-profile scheme accurately. One of her illustrations showed a weary-looking Huffman, 56, who was awoken Tuesday by seven FBI agents, with guns drawn, at the family home she shares with William H. Macy and taken into custody. In court, the fallen star was shrinking in her seat behind her fellow defendants.

But according to Edwards, Loughlin, 54, managed to surprise her.

“[They were] very, very different,” Edwards told the news site about the two women during their days in court. “Totally different attitude, expression and the way that the body was held.”

Unlike Huffman, Loughlin had the luxury of negotiating her surrender and appeared in court with full hair and makeup done, along with a defiant look. While sitting, the “Fuller House” star had her arms crossed and they stayed that way the whole time.

OLIVIA MUNN SLAMS LORI LOUGHLIN, FELICITY HUFFMAN

“Kind of a defensive deflection like ‘Don’t touch me. What am I doing here? Where are my people? When am I getting out?’ It was so defiant,” said Edwards, who regularly covers court cases. “Loughlin came off, and I think it showed in my drawings, a little arrogant. An illustrator can bring that out maybe more than a camera. However, I wasn’t being subjective. I was just drawing what I saw.”

“The way people stand, their body language, their attitude — it all plays a part in an illustration,” added Edwards.

Edwards said Loughlin dressed in a white turtleneck, which she described as “like the good guy kind of thing.”

“Her hair was perfectly styled, but it covered half of her face,” said Edwards. “And she wore the glasses. It was all kind of covering up.”

Edwards admitted she was concerned about her Loughlin drawing.

CELEBS POKE FUN AT COLLEGE ADMISSIONS SCANDAL

“I was thinking I made her too stern,"" she said. ""But that’s what she looked like. There’s this thin line about whether I want to please the public and draw something [they’d like to see] or draw something warts and all and I chose [the latter].”

Some commenters have pointed out Edwards’ sketch of Loughlin resembled first lady Melania Trump. Edwards said she found the comparisons comical, but stressed, “That didn’t even dawn on me.”

“Maybe because of the turtleneck,” said Edwards. “Melania wears a lot of turtlenecks.”

Huffman, who was arrested and brought right to court, wasn’t given the Hollywood treatment when it came to her appearance. Unlike Loughlin, the “Desperate Housewives” actress was arrested and brought right to court.

“She didn’t have the time element Loughlin had,” said Edwards. “So obviously she didn’t have time to call a makeup artist and say, ‘Hey, can you make me look great for court today?’”

Instead, Huffman sat behind another defendant and kept her head down until her name was called.

“I think Huffman was more authentic and genuine,” noted Edwards.

CLICK HERE FOR THE FOX NEWS APP

As for Macy, 69, Edwards managed to capture an up close and personal portrait as she was seated right next to him.

“I said hello, he said hello,” she recalled. “Then I started the drawing — and I’m drawing his wife — while he’s sitting literally three inches from me. The sketch of him, he’s literally touching shoulders with me. He leaned over and said, ‘You are really good.’ I said, ‘Thank you.’”

Edwards said there was a tense moment when another sketch artist tapped Macy on the shoulder and asked, “Would you tell me who your wife is?” He responded, “I will not.” Edwards apologized for her colleague’s behavior to avoid any awkwardness.

“At that point, he was like my friend,” she said.

Edwards added Macy had books with him and was reading until Huffman had to speak with the judge.

“When his wife stood up and was talking, he, of course, looked very intense and emotional,” she said.

When the proceedings were over, Macy thanked Edwards for drawing him.

“I said, ‘I wish it was in a different situation — someplace else,’” said Edwards. “And I wished him all the best. He put his hand on my shoulder, thanked me and said to have a good day. It was a very pleasant and respectful kind of thing.”

Loughlin and her husband, fashion designer Mossimo Giannulli, were out in $1 million bonds respectively after allegedly paying $500,000 in bribes to have their two daughters designated as recruits for the University of Southern California’s crew team, despite the fact that neither of them participated in the sport.

Huffman, meanwhile, was released on $250,000 bond after allegedly paying $15,000 disguised as a charitable donation so that her daughter could take part in a somewhat rigged college entrance-exam.

More than four dozen people have been charged in the nationwide scam, which is alleged to have placed students in top-tier schools like Yale, Georgetown, Stanford, the University of Southern California, UCLA and the University of Texas. A federal investigation into the matter – dubbed ""Operation Varsity Blues"" – has been ongoing for more than a year.

Fox News’ Tyler McCarthy contributed to this report.

"	['university', 'looked', 'huffman', 'artist', 'loughlin', 'macy', 'genuine', 'arrogant', 'way', 'lori', 'court', 'wife', 'edwards', 'felicity', 'sketch', 'drawing']	"Edwards’ colorful sketches of actresses Lori Loughlin and Felicity Huffman facing the judge for their alleged involvement in a massive college admissions scandal quickly spread throughout social media.
But according to Edwards, Loughlin, 54, managed to surprise her.
“[They were] very, very different,” Edwards told the news site about the two women during their days in court.
It was all kind of covering up.”Edwards admitted she was concerned about her Loughlin drawing.
“Then I started the drawing — and I’m drawing his wife — while he’s sitting literally three inches from me."
26	https://www.nbcnews.com/news/us-news/lori-loughlin-s-daughter-olivia-jade-loses-sephora-partnership-wake-n983331	['Janelle Griffith', 'Janelle Griffith Is A Breaking News Reporter For Nbc News.', 'Diana Dasrath']	None	"Breaking News Emails Get breaking news alerts and special reports. The news and stories that matter, delivered weekday mornings.

March 14, 2019, 6:05 PM GMT / Updated March 14, 2019, 9:09 PM GMT By Janelle Griffith and Diana Dasrath

The fallout has begun for actress Lori Loughlin in the wake of her arrest this week for her alleged ties to a college admissions scandal, and for her daughter Olivia Jade Giannulli.

Loughlin was fired Thursday from the Hallmark Channel, on which she has been a staple, and beauty retailer Sephora announced hours earlier it has ended its partnership with Giannulli, who is a social media influencer.

""We are saddened by the recent news surrounding the college admissions allegations,"" the parent company of the Hallmark Channel said in a statement. ""We are no longer working with Lori Loughlin and have stopped development of all productions that air on the Crown Media Family Network channels involving Lori Loughlin including Garage Sale Mysteries, an independent third party production.""

The company also said all of Loughlin's completed work will be removed.

As for Sephora, the company told NBC News in a statement: ""After careful review of recent developments, we have made the decision to end the Sephora Collection partnership with Olivia Jade, effective immediately.""

Giannulli, 19, is a YouTube star and was a collaborator and paid influencer with Sephora. She released a bronzing powder palette with Sephora in December 2018. The $28, six-color Olivia Jade x Sephora Collection Bronze & Illuminate Palette was no longer available on the company's website Thursday. A search for the palette returns a message saying the product is not carried.

Haircare brand TRESemmé said in a statement Thursday it was ending its partnership with Giannulli. She advertised the brand's products on her Instagram page after attending a TRESemmé event during New York Fashion Week just last month.

Giannulli is in her first year at the University of Southern California.

Loughlin, best known for her role in the 1980s-90s sitcom ""Full House,"" was one of the dozens of people charged this week in connection with the $25 million college admissions scheme.

Federal prosecutors allege she and her fashion designer husband, Mossimo Giannulli, agreed to pay bribes totaling $500,000 to bolster their two daughters' chances of gaining admission to USC.

Loughlin was released on a $1 million bond Wednesday after surrendering to federal authorities.

Giannulli was spending spring break in the Bahamas on a top USC official's yacht when federal authorities announced indictments in the scheme Tuesday.

She was on Rick Caruso's luxury yacht with his daughter Gianna, with whom she has been friends for years, Caruso told NBC News.

Caruso, who was elected chair of the university's board of trustees in May 2018, is the founder and owner of Caruso's, one of the country's largest privately-held real estate companies, whose holdings include The Grove in Los Angeles.

Once they became aware of the investigation, Caruso said, the women returned home.

A USC spokesman said applicants who are connected to the scheme will be denied admission and a case-by-case review will be conducted for students who are already enrolled at the university and may be connected to the criminal investigation.

""We will make informed, appropriate decisions once those reviews have been completed,"" the spokesman said. ""Some of these individuals may have been minors at the time of their application process.""

Olivia Jade and her sister, Isabella Giannulli, are still enrolled at USC, a representative for the university told NBC News on Thursday."	['university', 'statement', 'week', 'partnership', 'sephora', 'loughlin', 'giannulli', 'partnerships', 'olivia', 'scandal', 'lori', 'jade', 'fired', 'hallmark', 'usc', 'loses', 'palette', 'daughter', 'told']	"March 14, 2019, 6:05 PM GMT / Updated March 14, 2019, 9:09 PM GMT By Janelle Griffith and Diana DasrathThe fallout has begun for actress Lori Loughlin in the wake of her arrest this week for her alleged ties to a college admissions scandal, and for her daughter Olivia Jade Giannulli.
""We are saddened by the recent news surrounding the college admissions allegations,"" the parent company of the Hallmark Channel said in a statement.
The $28, six-color Olivia Jade x Sephora Collection Bronze & Illuminate Palette was no longer available on the company's website Thursday.
Haircare brand TRESemmé said in a statement Thursday it was ending its partnership with Giannulli.
Olivia Jade and her sister, Isabella Giannulli, are still enrolled at USC, a representative for the university told NBC News on Thursday."
27	https://uproxx.com/viral/lori-loughlin-husband-mossimo-giannulli-trump-supporter/	['Stacey Ritzen', 'Derrick Rossignol', 'Philip Cosores', 'Chloe Gilke', 'News', 'Culture Writer']	2019-03-15 18:10:12+00:00	"Getty Image

The fallout of Operation Varsity Blues, as it’s now being called, has been full of schadenfreude, to say the least. Actress Lori Loughlin, whose wholesome Full House image that had been the staple of the Hallmark channel (note, past-tense) for years is suddenly looking at five years in prison for shelling out $500,000 to get her ungrateful daughters into the University of Southern California — and people are absolutely riveted.

Of course, Loughlin did not act alone, as her apparel company-founder husband, Mossimo Giannulli, shares the blame for the alleged crime. And while there has been lots and lots of irony associated with Loughlin’s part in the scandal, her husband asks to kindly hold his fancy beer while he adds some hypocrisy to the whole thing.

According to Tom Arnold, just weeks before the scandal broke, Giannulli was sloshed at a Hollywood party going on about his support for President Donald Trump and how people should be “carrying their own weight.” Oh, do tell!

“Couple wks ago I got into it with for 10th time with #CollegeCheatingScandal DAD at big party cause his sloppy ass was rambling on again about Trump & people carrying their own weight & his own conservative politics being ‘right of Attila the Hun,'” Arnold, an outspoken Trump critic tweeted earlier this week. “He embarrassed Scandal Mom again.”"	['trump', 'frequently', 'complains', 'party', 'lots', 'loughlin', 'supporter', 'giannulli', 'vocal', 'carrying', 'scandal', 'loughlins', 'lori', 'arnold', 'husband', 'weight']	"Getty ImageThe fallout of Operation Varsity Blues, as it’s now being called, has been full of schadenfreude, to say the least.
Of course, Loughlin did not act alone, as her apparel company-founder husband, Mossimo Giannulli, shares the blame for the alleged crime.
And while there has been lots and lots of irony associated with Loughlin’s part in the scandal, her husband asks to kindly hold his fancy beer while he adds some hypocrisy to the whole thing.
According to Tom Arnold, just weeks before the scandal broke, Giannulli was sloshed at a Hollywood party going on about his support for President Donald Trump and how people should be “carrying their own weight.” Oh, do tell!
“He embarrassed Scandal Mom again.”"
28	https://www.vibe.com/2019/03/lori-loughlin-daughters-drop-out-usc	"[""J'Na Jefferson""]"	2019-03-15 10:14:58-04:00	"Lori Loughlin's Daughters Drop Out Of USC Amid College Cheating Scandal

""I don't really care about school, as you guys all know..."" - Olivia Jade Giannulli

Full House star Lori Loughlin is among the 50 parents who were indicted for ties to a college admission cheating/bribery scandal that was uncovered earlier this week. Her two daughters, Olivia Jade and Isabella Rose, are reportedly dropping out of USC due to the fear that they'll be bullied for their parents' unlawful actions.

Per reports, Olivia, 19, and Isabella, 20, are leaving the California school and will hold off from applying anywhere else for the time being. Olivia Jade, who is a social media influencer, also lost lucrative deals with Sephora, HP and TRESemmé in the wake of the scandal.

On her popular YouTube channel, Olivia Jade posted a video about how she doesn't care about school, but knows that education is important to have. ""I do want the experience of game days, partying... I don't really care about school, as you guys all know,"" she laughed in the vid.

The indictment claims that former Hallmark Channel staple Loughlin and her designer husband Mossimo Giannuli paid $500,000 to designate their daughters as recruits to the USC crew team, despite none of the girls participating in the activity.

Former Desperate Housewives star Felicity Huffman was also named in the indictment. She allegedly paid a proctor $15,000 to boost her eldest daughter's SAT score 400 points, with the hopes that she'd get into a better school."	['daughters', 'school', 'really', 'paid', 'olivia', 'usc', 'parents', 'loughlins', 'lori', 'jade', 'care', 'fear', 'drop', 'bullying', 'star']	"Lori Loughlin's Daughters Drop Out Of USC Amid College Cheating Scandal""I don't really care about school, as you guys all know..."" - Olivia Jade GiannulliFull House star Lori Loughlin is among the 50 parents who were indicted for ties to a college admission cheating/bribery scandal that was uncovered earlier this week.
Her two daughters, Olivia Jade and Isabella Rose, are reportedly dropping out of USC due to the fear that they'll be bullied for their parents' unlawful actions.
Olivia Jade, who is a social media influencer, also lost lucrative deals with Sephora, HP and TRESemmé in the wake of the scandal.
On her popular YouTube channel, Olivia Jade posted a video about how she doesn't care about school, but knows that education is important to have.
I don't really care about school, as you guys all know,"" she laughed in the vid."
29	https://www.cheatsheet.com/entertainment/did-lori-loughlins-husband-mossimo-giannulli-also-fake-his-way-through-college.html/	['Christina Montford']	2019-03-15 20:59:47+00:00	"Former Full House actress Lori Loughlin and her husband fashion designer Mossimo Giannulli have been in hot water recently after being indicted for being part of a nationwide college admissions scam.

The couple, along with over 40 others, has been accused of paying thousands of dollars to get their children into prestigious universities like the University of Southern California, Yale, and more.

Specifically, Loughlin and Giannulli are accused of paying $500,000 to have their daughters admitted to USC on rowing scholarships, despite their girls never participating in rowing activities before.

Giannulli faking his way through college

Fans of both the designer and Loughlin were shocked to find out that the parents had lied to get their children into school, but days before the news broke, their daughter Olivia Jade alluded to the fact that lying about education may be nothing new for the family.

“He didn’t come from a lot so it’s cool to see that he built it all himself,” she said of her father on the Zach Sang Show. “He, like, built his whole entire brand and he wasn’t actually, like, I don’t know if I’m supposed to say this, ever enrolled in college. But he, like, faked his way through it and then he started his whole business with tuition money that his parents thought was going to college. That’s, like, such a different time. I don’t know if I was supposed to say that, but it’s okay.”

What’s even worse is that Jade had recently become a go-to source for girls applying to school .

“It’s the coolest thing getting DMs from girls being like ‘I’m applying to college right now, what did you do?’ she said on the show. “It’s fun!”

She even revealed that it was her parents who pressured her to go to school.

“Mostly my parents wanted me to go because both of them didn’t go to college,” she continued. “I’m so happy they made me go. That sounds so terrible, they didn’t make me. My sister goes to the same school and we are pretty much inseparable, so it was nice following in her footsteps in a little bit. I do like it.”

Olivia Jade’s partying ways

The YouTube star has also been under fire after a video of her saying that she was only in school to party resurfaced.

“I don’t know how much of school I’m gonna attend but I’m gonna go in and talk to my deans and everyone, and hope that I can try and balance it all,” she said while answering fan questions. “But I do want the experience of like game days, partying…I don’t really care about school, as you guys all know.”

Once she started receiving backlash from people calling her privelaged, she retracted her statement.

“I said something super ignorant and stupid, basically,” she said in a follow up video. “And it totally came across that I’m ungrateful for college — I’m going to a really nice school. And it just kind of made it seem like I don’t care, I just want to brush it off. I’m just gonna be successful at YouTube and not have to worry about school. I’m really disappointed in myself.”

Since her parents’ arrests, both Olivia Jade and her sister Isabella Rose have dropped out of USC.

Read more: Why Did Lori Loughlin Delete her Instagram?

Check out The Cheat Sheet on Facebook!"	['school', 'fake', 'loughlin', 'really', 'giannulli', 'way', 'parents', 'loughlins', 'mossimo', 'lori', 'im', 'dont', 'jade', 'college', 'gonna', 'husband', 'know']	"Former Full House actress Lori Loughlin and her husband fashion designer Mossimo Giannulli have been in hot water recently after being indicted for being part of a nationwide college admissions scam.
“He, like, built his whole entire brand and he wasn’t actually, like, I don’t know if I’m supposed to say this, ever enrolled in college.
“I don’t know how much of school I’m gonna attend but I’m gonna go in and talk to my deans and everyone, and hope that I can try and balance it all,” she said while answering fan questions.
“And it totally came across that I’m ungrateful for college — I’m going to a really nice school.
I’m really disappointed in myself.”Since her parents’ arrests, both Olivia Jade and her sister Isabella Rose have dropped out of USC."
30	https://www.hollywoodreporter.com/news/lori-loughlin-fuller-house-ending-five-seasons-watch-1188030	['Ciara Mcvey', 'Ciara.Mcvey Thr.Com']	2019-02-19 13:08:32	"""I actually don’t want to see it end, to be honest with you. I think there’s still so many great stories to be told,"" the actress said of the show's impending conclusion.

The final chapter of the Tanner-Fuller family will be coming to a close with the upcoming fifth and final season of Netflix's Fuller House and star Lori Loughlin doesn’t think the story is ready to come to an end.

""I don't understand why it’s the final season, I have to be honest with you,"" she told The Hollywood Reporter In Studio. ""I think it does really well for Netflix and I don’t know their business model. I'm not sure how it all works because it's not like network television, but I was surprised. I know it was 18 episodes, which is a bigger order than usual, but I'm still surprised that they’re ending it at season five.""

Fuller House, the sequel to the beloved 1987-95 sitcom Full House, premiered in 2016 and follows the grown-up lives of D.J. Tanner-Fuller (Candace Cameron Bure) and Stephanie Tanner (Jodie Sweetin) and their longtime friend Kimmy Gibbler (Andrea Barber). Original Full House stars Bob Saget, John Stamos, Dave Coulier and Loughlin recur on the series.

Loughlin explained how she doesn’t want to see the series come to an end and is hoping to see it continue on another network: ""I think there's still so many great stories to be told, and who knows, maybe if Netflix says no more, maybe someone else will pick it up. Who knows?""

The actress has been a part of the Full House franchise since she joined the original series during its second season, but she didn't realize the love and devotion for the show until the Netflix spinoff was picked up in 2016.

""I always knew we were this beloved show, and generations had grown up on the show, but I think when it really came back as Fuller House, and that initial response was so overwhelming and it was so big, that I think that's when it finally really hit me,"" Loughlin said.

Watch the video above to hear Loughlin discuss joining the show, her Hallmark series When Calls the Heart and more."	['seasons', 'fuller', 'saying', 'loughlin', 'goodbye', 'think', 'final', 'lori', 'netflix', 'season', 'really', 'series', 'dont', 'house', 'told']	"The final chapter of the Tanner-Fuller family will be coming to a close with the upcoming fifth and final season of Netflix's Fuller House and star Lori Loughlin doesn’t think the story is ready to come to an end.
""I don't understand why it’s the final season, I have to be honest with you,"" she told The Hollywood Reporter In Studio.
Fuller House, the sequel to the beloved 1987-95 sitcom Full House, premiered in 2016 and follows the grown-up lives of D.J.
Original Full House stars Bob Saget, John Stamos, Dave Coulier and Loughlin recur on the series.
Watch the video above to hear Loughlin discuss joining the show, her Hallmark series When Calls the Heart and more."
