	url	authors	publish_date	text	keywords	summary
57	https://www.brides.com/story/lori-loughlin-doesnt-know-her-wedding-date	[]	None	"It’s pretty bad to forget your anniversary altogether, but just getting the date wrong is at least a little better, right? Well, how about mistaking the date of your wedding anniversary for the past 20 years? Where does that fall on the scale? Let's ask Fuller House star Lori Loughlin and her husband, fashion entrepreneur Mossimo Giannulli, who just realized that they have been celebrating their anniversary on the wrong day—for two entire decades.

The actress recently spilled her secret to a long-lasting marriage to Entertainment Tonight , and, while she was at it, shared this hilarious revelation.

""I was having dinner with Candace Cameron Bure and Marilu Henner, and you know, Marilu has that incredible memory,"" Loughlin began. ""Somehow we started talking about my elopement and I said, 'Yeah, we got up on Thanksgiving morning'... We had Moss' best friend and a minister meet us, and we got married at sunrise and then we went to Thanksgiving dinner and we told everybody.""

This was the second marriage for both Loughlin and Giannulli. She said that they originally considered having a traditional wedding , but one day—apparently on Thanksgiving—they decided to scrap the whole big to-do, and simply tie the knot in a low-key ceremony. You would thinking that since Loughlin and Giannulli's big day also happened to be Thanksgiving, it would be an easy day for the couple to remember. But, since the exact date of the holiday changes each year, things got confusing.

Loughlin continued, ""Marilu happened to say, 'Oh, what is your wedding date?' And I said, 'It's Nov. 25, 1997,' and she goes, 'No no, Nov. 25 was a Tuesday... Nov. 27, 1997 that was Thanksgiving,'"" And as it turns out, ""She was right!”

Marilu Henner might have just won BFF MVP for remembering her friend's correct wedding date after all these years. Henner is an actress, but her biggest claim to fame might be her ability to remember literally everything. She has a Highly Superior Autobiographical Memory, which gives her the ability to recall the slightest details of almost every day she has lived, according to AARP . Clearly her special skills really came in handy for Loughlin who might have otherwise never realized the mistake, as the incorrect wedding date is even on her marriage certificate.

“...they had written Nov. 25 and that's what it says on my marriage license ,"" she said.

See more : 4 Things to Keep in Mind If You're Planning a Holiday Wedding

Regardless of the date, Loughlin and her hubby couldn’t be more in love.""He's my guy, he's my person,"" the actress said, adding what exactly makes their marriage work. ""It's communicating , it's listening, it's picking and choosing your battles. It's being flexible, it's all of that. One day at a time, one step at a time.”

And as for their anniversary snafu, Loughlin has the best idea for rectifying the situation. ""I called my husband, and I'm like, 'Oh my goodness, we have been celebrating two days early!'"" she said. ""So it's actually Nov. 27, 1997... I think we're going to make [our anniversary] a three-day festival now."""	['nov', 'wrong', 'marriage', 'thanksgiving', 'day', 'loughlin', 'celebrating', '20', 'henner', 'wedding', 'lori', 'date', 'anniversary', 'marilu']	"It’s pretty bad to forget your anniversary altogether, but just getting the date wrong is at least a little better, right?
Well, how about mistaking the date of your wedding anniversary for the past 20 years?
""I was having dinner with Candace Cameron Bure and Marilu Henner, and you know, Marilu has that incredible memory,"" Loughlin began.
Loughlin continued, ""Marilu happened to say, 'Oh, what is your wedding date?'
See more : 4 Things to Keep in Mind If You're Planning a Holiday WeddingRegardless of the date, Loughlin and her hubby couldn’t be more in love."
58	https://www.goodhousekeeping.com/beauty/a42376/lori-loughlin-interview/	['Sarah Walter']	2017-01-17 02:00:01	"Now streaming on Netflix: The second season of nineties reboot Fuller House and Hallmark Channel's When Calls the Heart. And yes, she looks amazing at 52. Here's why:

Her skincare secrets: There's no magic here! I wear SPF, moisturize and wash my face before bed. I treat myself to facials now, but even when I couldn't afford to do that, I'd get scrubs and masks from the drugstore.

Favorite Valentine's Day memories: Every Valentine's Day growing up, my dad would give me a strawberry cream-filled chocolate heart from Russell Stover. These days, family or friends still give me one.

Her ultimate beauty rules: My daughter Olivia [17] is a YouTube vlogger, and my daughter Bella [18] is a fashion blogger. They definitely try to guide me fashion- and beauty-wise. They're supportive and compliment me, but they definitely will step in to say, ""Don't wear that.""

Family traditions: Sunday nights we have dinner together, and we play games on game night; once a year, we get away to ski — when you get kids out of their home environment, they're forced to be with you and you have a captive audience.

The woman has great fashion advice too. Go here to see Lori rocking winter's coziest looks »

This story originally appeared in the February 2017 issue of Good Housekeeping."	['day', 'daughter', 'age', 'theyre', 'looks', 'loughlin', 'fashion', 'valentines', 'definitely', 'lori', 'wear', 'dont', 'talk', 'heart', 'youtube', 'right']	"Now streaming on Netflix: The second season of nineties reboot Fuller House and Hallmark Channel's When Calls the Heart.
Favorite Valentine's Day memories: Every Valentine's Day growing up, my dad would give me a strawberry cream-filled chocolate heart from Russell Stover.
Her ultimate beauty rules: My daughter Olivia [17] is a YouTube vlogger, and my daughter Bella [18] is a fashion blogger.
They're supportive and compliment me, but they definitely will step in to say, ""Don't wear that.""
Go here to see Lori rocking winter's coziest looks »This story originally appeared in the February 2017 issue of Good Housekeeping."
59	http://www.justjared.com/2018/03/01/lori-loughlin-explains-why-she-didnt-attend-john-stamos-wedding/	['Stepanie Lowe']	2018-03-01 00:00:00	"Lori Loughlin did not attend John Stamos‘ wedding to Caitlin McHugh last month and she’s explaining why she was absent from her longtime co-star’s special day.

“We were all invited. Unfortunately Candace [Cameron Bure] and I already committed to go to the Super Bowl months and months and months in advance so we couldn’t be there. But we certainly were all invited. All the Hallmark executives were taking us to the Super Bowl. It was so much fun but we already committed to that. So we unfortunately could not be at John’s wedding,” she told Us Weekly.

“I sent flowers and I was really bummed that I already had plans. Dave [Coulier] went, Jodie [Sweetin] went. I think Bob [Saget] was there. Candace and I would have been there, we just unfortunately — timing. And Caitlin and John — they were a little last-minute in their planning and preparation and we had already committed to something else,” she continued.

She added, “I’m so happy he’s going to be a dad. He’s going to be a great dad. He’s always been good with kids. And Caitlin is just the greatest girl. She’s so good for him. I’m happy to see that he’s finally found love.”"	['unfortunately', 'hes', 'caitlin', 'john', 'loughlin', 'super', 'didnt', 'went', 'months', 'wedding', 'lori', 'explains', 'committed', 'shes', 'attend', 'stamos']	"Lori Loughlin did not attend John Stamos‘ wedding to Caitlin McHugh last month and she’s explaining why she was absent from her longtime co-star’s special day.
Unfortunately Candace [Cameron Bure] and I already committed to go to the Super Bowl months and months and months in advance so we couldn’t be there.
So we unfortunately could not be at John’s wedding,” she told Us Weekly.
Dave [Coulier] went, Jodie [Sweetin] went.
And Caitlin and John — they were a little last-minute in their planning and preparation and we had already committed to something else,” she continued."
60	https://pagesix.com/2017/03/16/lori-loughlin-and-husband-list-remodeled-bel-air-mansion-for-35m/	['Lisa Kaplan Gordon', 'March']	2017-03-16 00:00:00	"Click to email this to a friend (Opens in new window)

Click to share on Twitter (Opens in new window)

Click to share on Facebook (Opens in new window)

“Full House” actress Lori Loughlin and her fashion designer husband, Mossimo Giannulli, are asking a whopping $35 million for their Bel Air, California, mansion, Variety says.

The gated five-bedroom house borders a couple of sand traps on the Bel Air Country Club golf course. The contemporary Mediterranean features a two-story entryway with a grand staircase, and a master suite with his-and-her bathrooms and closets.

The back yard has a swimming pool and spa, and the garage off the circular motor court can hold five cars.

The house, which the couple bought in 2015 for about $14 million, is part of a string of real estate renovations they have completed, including a makeover of a 1920s Tuscan villa, a remodeling of a 1940s Georgian in Bel Air and an Aspen, Colo., contemporary.

Loughlin, 52, is best known for playing a supporting role in ABC’s sitcom “Full House” and for her recurring role in the sequel, “Fuller House.” On Thanksgiving 1997, Loughlin eloped with Giannulli, founder of the Mossimo clothing line, which he sold to Target in 2000 for a reported $135 million. They have two daughters."	['bel', 'role', 'million', 'loughlin', 'air', 'remodeled', 'list', 'lori', 'share', 'mossimo', 'windowclick', '35m', 'husband', 'opens', 'house', 'mansion']	"Click to email this to a friend (Opens in new window)Click to share on Twitter (Opens in new window)Click to share on Facebook (Opens in new window)“Full House” actress Lori Loughlin and her fashion designer husband, Mossimo Giannulli, are asking a whopping $35 million for their Bel Air, California, mansion, Variety says.
The gated five-bedroom house borders a couple of sand traps on the Bel Air Country Club golf course.
The contemporary Mediterranean features a two-story entryway with a grand staircase, and a master suite with his-and-her bathrooms and closets.
The back yard has a swimming pool and spa, and the garage off the circular motor court can hold five cars.
The house, which the couple bought in 2015 for about $14 million, is part of a string of real estate renovations they have completed, including a makeover of a 1920s Tuscan villa, a remodeling of a 1940s Georgian in Bel Air and an Aspen, Colo., contemporary."
61	https://www.click2houston.com/entertainment-tonight/lori-loughlin-has-been-celebrating-her-wedding-anniversary-on-the-wrong-day-for-20-years-exclusive	[]	2018-02-23 20:23:33+00:00	"Lori Loughlin and her husband, fashion mogul Mossimo Giannulli, were so eager for their first wedding anniversary that they celebrated it two days earlier -- and have been doing it for the past 20 years!

ET's Deidre Behar sat down with the actress on Thursday, where she opened up about the secret to her long-lasting marriage, admitting that it clearly has nothing to do with remembering your anniversary. As Loughlin confessed, it wasn't until recently that she discovered she and Giannulli had been celebrating on the wrong day, thanks to Marilu Henner.

""I was having dinner with Candace Cameron Bure and Marilu Henner, and you know, Marilu has that incredible memory,"" she explained. ""Somehow we started talking about my elopement and I said, 'Yeah, we got up on Thanksgiving morning'... We had Moss' best friend and a minister meet us, and we got married at sunrise and then we went to Thanksgiving dinner and we told everybody.""

""Marilu happened to say, 'Oh, what is your wedding date?' And I said, 'It's Nov. 25, 1997,' and she goes, 'No no, Nov. 25 was a Tuesday... Nov. 27, 1997 that was Thanksgiving,'"" Loughlin continued. ""She was right! And on my marriage certificate, they had written Nov. 25 and that's what it says on my marriage license.""

""So I called my husband, and I 'm like, 'Oh my goodness, we have been celebrating two days early!'"" she said with a laugh. ""So it's actually Nov. 27, 1997... I think we're going to make [our anniversary] a three-day festival now.""

After 20 years of wedded bliss, the couple definitely deserves the celebration.

""Moss and I had both been married before, so we thought, 'Well, it didn't really work out well for us the first time around, so maybe we'll elope and see how it goes and tell people,'"" Loughlin recalled of their decision to tie the knot. ""We had talked about doing a wedding and we just thought, 'Let's get up and let's go do it.'""

""He's my guy, he's my person,"" she gushed, before revealing the qualities that make their marriage work. ""It's communicating, it's listening, it's picking and choosing your battles. It's being flexible, it's all of that.""

""One day at a time, one step at a time,"" she added.

Watch Loughlin on When Calls the Heart, airing Sundays at 9 p.m. ET/PT on Hallmark. See more on the actress -- and her adorable daughters -- in the video below.

RELATED CONTENT:

Candace Cameron Bure & Lori Loughlin Bring Doppleganger Daughters to Golden Globe After-Party -- See the Pic!

Lori Loughlin Shares Sweet Throwback Photo in Celebration of 20th Wedding Anniversary

Lori Loughlin Hits the Red Carpet With Look-Alike Daughters, Gets Sweet Birthday Wish From John Stamos"	['nov', 'wrong', 'day', 'marriage', 'thanksgiving', 'daughters', 'loughlin', '1997', 'exclusive', 'celebrating', '20', 'wedding', 'lori', '25', 'anniversary', 'marilu']	"Lori Loughlin and her husband, fashion mogul Mossimo Giannulli, were so eager for their first wedding anniversary that they celebrated it two days earlier -- and have been doing it for the past 20 years!
As Loughlin confessed, it wasn't until recently that she discovered she and Giannulli had been celebrating on the wrong day, thanks to Marilu Henner.
And I said, 'It's Nov. 25, 1997,' and she goes, 'No no, Nov. 25 was a Tuesday... Nov. 27, 1997 that was Thanksgiving,'"" Loughlin continued.
And on my marriage certificate, they had written Nov. 25 and that's what it says on my marriage license.""
Lori Loughlin Shares Sweet Throwback Photo in Celebration of 20th Wedding AnniversaryLori Loughlin Hits the Red Carpet With Look-Alike Daughters, Gets Sweet Birthday Wish From John Stamos"
62	https://etcanada.com/news/246399/lori-loughlins-daughter-takes-heat-for-allegedly-vlogging-while-driving-before-car-crash/	['Corey Atad']	2017-08-08 14:06:00	"Lori Loughlin’s daughter is being criticized for allegedly vlogging while driving just before getting into a car accident.

RELATED: ‘When Calls The Heart’: ET Canada On The Set With Lori Loughlin

Olivia Jade Giannulli, 17, who has a YouTube following of nearly 1 million subscribers, posted a video Sunday detailing the crash, and featuring video filmed both before and after the incident while driving, the Daily Mail reported. The video has since been taken down.

Giannulli said a truck hit her vehicle from behind while she was waiting at a red light. She than attempted to continue driving, but a AAA driver who happened to witness the accident honked at her, and informed her that the back of her car was smoking.

“I don’t know if the man who hit me was texting or just purely wasn’t paying attention, but please always always look at the road when you’re driving. I promise to never vlog, text, etc. when I drive again because not only could you injure yourself, but you could hurt or kill another person,” Giannulli said.

RELATED: New Kids On The Block Visit Netflix’s ‘Fuller House’

Still, a number of fans took issue with the fact that Giannulli had been vlogging while driving in the first place. “I’m glad you’re okay—but I really have to say I hope this is a lesson to everyone thinking it’s okay to text, OR vlog or make insta/snapchat while driving because IT IS NOT OKAY!!!” one person commented on the YouTube video before it was taken down.

Loughlin has spoken out to defend her daughter in a video on TMZ, claiming that the piece in the Daily Mail had “misrepresented” the incident. “She was not on her phone. That was all absolute BS,” the “Fuller House” star insists."	['vlogging', 'text', 'vlog', 'giannulli', 'video', 'youre', 'person', 'takes', 'car', 'taken', 'loughlins', 'lori', 'driving', 'crash', 'allegedly', 'daughter', 'youtube', 'heat']	"Lori Loughlin’s daughter is being criticized for allegedly vlogging while driving just before getting into a car accident.
“I don’t know if the man who hit me was texting or just purely wasn’t paying attention, but please always always look at the road when you’re driving.
I promise to never vlog, text, etc.
when I drive again because not only could you injure yourself, but you could hurt or kill another person,” Giannulli said.
!” one person commented on the YouTube video before it was taken down."
63	https://hellogiggles.com/news/lori-loughlin-john-stamos-full-house-married/	['Karen Belz']	None	"Even though she’s been happily married for over two decades, a lot of Full House fans still hope that Lori Loughlin and John Stamos (aka Aunt Becky and Uncle Jesse) will end up together. The good news is that it seems as though Loughlin and her actual husband think this is all pretty funny.

In case you missed it, Stamos is expecting his first child with his wife, Caitlin McHugh. The two announced the news in December 2017, just two months after announcing their plans to wed. Loughlin is married to Mossimo Giannulli (who yes, is famous for the “Mossimo” brand), and the pair has two daughters together — Isabella and Olivia, both teens. It’s the second marriage for Loughlin, who divorced her first husband back in 1996.

""Whenever I post something with my husband, people will write comments,"" she said to Entertainment Tonight. ""I laugh now, I think its funny. They’re like, ‘You should’ve married John!’""

Giannulli, thankfully, finds it all pretty funny, too.

""What's even funnier though, is sometimes my husband will comment back and say, 'Yeah, you should have!' or something funny like that,"" she continued. ""Like, he'll just pop off!""

At least fans will always be able to relive Becky and Jesse’s chemistry in Full House reruns. And hey — sometimes they both appear on Fuller House, the uber-successful Netflix spinoff.

Loughlin is also more than supportive of all of Stamos’s big news and thinks he’s going to be an excellent father.

""I'm so excited for him,"" she said, noting that he's wanted a family for some time. ""It's long overdue and his wife is a really great girl. She's very good for him. I'm happy that they found each other, and I'm really excited that he's going to be a dad.""

Maybe Loughlin’s girls can babysit on occasion? Cue the cuteness."	['married', 'hes', 'shes', 'fans', 'funny', 'john', 'loughlin', 'think', 'revealed', 'lori', 'wife', 'handles', 'husband', 'house', 'stamos']	"Even though she’s been happily married for over two decades, a lot of Full House fans still hope that Lori Loughlin and John Stamos (aka Aunt Becky and Uncle Jesse) will end up together.
The good news is that it seems as though Loughlin and her actual husband think this is all pretty funny.
In case you missed it, Stamos is expecting his first child with his wife, Caitlin McHugh.
It’s the second marriage for Loughlin, who divorced her first husband back in 1996.
Loughlin is also more than supportive of all of Stamos’s big news and thinks he’s going to be an excellent father."
64	http://www.wetpaint.com/lori-loughlin-instagram-sexy-photos-1558555/	['January']	2017-01-24 13:48:32-04:00	"18 Lori Loughlin Instagram Photos Proving Aunt Becky is Still Fire

Like Uncle Jesse once said, some things are forever!

With Full House in the past and Fuller House in the present, there is one constant that hasn’t changed — Lori Loughlin, aka Aunt Becky. The actress is still insanely beautiful!



Trust us, you won’t believe how stunning your favorite TV aunt still looks after all these years..."	['tv', 'things', 'loughlin', 'stunning', 'becky', 'aunt', 'uncle', 'proving', 'lori', 'instagram', '18', 'wont', 'house', 'photos']	"18 Lori Loughlin Instagram Photos Proving Aunt Becky is Still FireLike Uncle Jesse once said, some things are forever!
With Full House in the past and Fuller House in the present, there is one constant that hasn’t changed — Lori Loughlin, aka Aunt Becky.
The actress is still insanely beautiful!
Trust us, you won’t believe how stunning your favorite TV aunt still looks after all these years..."
65	http://www.justjared.com/2017/08/10/melanie-griffith-celebrates-her-60th-birthday-with-kris-jenner-lori-loughlin/	[]	2017-08-10 00:00:00	"Melanie Griffith is all smiles as she arrives at Craig’s restaurant for her 60th birthday celebration on Wednesday night (August 9) in West Hollywood, Calif.

The actress went glam in a red dress as she was joined by famous friends including BFF Kris Jenner and Lori Loughlin.

PHOTOS: Check out the latest pics of Melanie Griffith

“Birthday dinner with my girlfriends❤️❤️❤️ @krisjenner @loreerodkin @lizedlich at my favorite restaurant @craigsla,” Melanie captioned the below photo of herself with her friends.

Later that night, Kris headed to daughter Kylie Jenner‘s 20th surprise birthday party."	['restaurant', 'kris', 'celebrates', 'night', 'jenner', 'loughlin', 'red', 'went', 'surprise', 'lori', 'birthday', '60th', 'griffith', 'smiles', 'melanie', 'west']	"Melanie Griffith is all smiles as she arrives at Craig’s restaurant for her 60th birthday celebration on Wednesday night (August 9) in West Hollywood, Calif.
The actress went glam in a red dress as she was joined by famous friends including BFF Kris Jenner and Lori Loughlin.
PHOTOS: Check out the latest pics of Melanie Griffith“Birthday dinner with my girlfriends❤️❤️❤️ @krisjenner @loreerodkin @lizedlich at my favorite restaurant @craigsla,” Melanie captioned the below photo of herself with her friends.
Later that night, Kris headed to daughter Kylie Jenner‘s 20th surprise birthday party."
66	https://etcanada.com/news/250431/fuller-house-stars-john-stamos-and-lori-loughlin-have-a-frozen-sing-along-thats-just-too-cute/	[]	2017-08-24 12:02:00	"John Stamos and Lori Loughlin really know their Disney tunes.

On Thursday, the 54-year-old actor shared a video of himself lip-syncing to “Frozen”‘s “Love Is an Open Door” song alongside his onscreen wife while on set of their Netflix series “Fuller House”. “Frozen in time w/ @loriloughlin,” he captioned the adorable performance.

The video begins with just Stamos in the frame, mouthing Hans’ lyrics: “It’s amazing we finish each other’s…”

That’s when Loughlin jumps out from behind the door and delivers Anna’s line: “Sandwiches!”

The two then lip-sync together: “I’ve never met someone who thinks so much like me! Jinx. Jinx again!”

MORE: Lori Loughlin on Why She Never Hooked Up With Her ‘Full House’ Co-Star John Stamos

While Stamos clearly gets along with his onscreen main squeeze, he told ET back in March that he sometimes thinks that his “Fuller House” co-stars like his girlfriend, Caitlin McHugh, more than him.

“They’re like, ‘Is Caitlin coming?'” he quipped. “‘We don’t care about you, is Caitlin coming?'”

EXCLUSIVE: Lori Loughlin on Keeping Up With Her Teenage Daughters — They Need to Tuck Me in at Night

“We love Caitlin. She’s great. We do game nights at their house,” agreed Jodie Sweetin, who plays Stamos’ niece on the show. “We really like them.”

Check out more of ET’s exclusive interview with Stamos:

More From ET:"	['onscreen', 'fuller', 'love', 'caitlin', 'john', 'loughlin', 'video', 'thinks', 'singalong', 'stars', 'lori', 'frozen', 'really', 'thats', 'house', 'stamos']	"John Stamos and Lori Loughlin really know their Disney tunes.
On Thursday, the 54-year-old actor shared a video of himself lip-syncing to “Frozen”‘s “Love Is an Open Door” song alongside his onscreen wife while on set of their Netflix series “Fuller House”.
'”EXCLUSIVE: Lori Loughlin on Keeping Up With Her Teenage Daughters — They Need to Tuck Me in at Night“We love Caitlin.
We do game nights at their house,” agreed Jodie Sweetin, who plays Stamos’ niece on the show.
“We really like them.”Check out more of ET’s exclusive interview with Stamos:More From ET:"
